{
  "schema_version": "1",
  "change_id": "creator-visual-identity-full-v3",
  "summary": "Two-stage open-set Creator visual identity and visual-backed Creator-Adaptive v3 shadow pipeline.",
  "capabilities": [
    "avatar_identity_provider",
    "creator_visual_identity",
    "creator_identity",
    "voice_profile",
    "trusted_speech_memory",
    "creator_lexicon",
    "creator_adaptive_asr",
    "human_review"
  ],
  "files_changed": [
    "config/creator_visual_identity.json",
    "docs/avatar-detector-design.md",
    "evidence/validation/adaptive-shadow-v3-real.json",
    "evidence/validation/creator-adaptive-full-change-manifest.json",
    "evidence/validation/creator-adaptive-v3-real-run.json",
    "evidence/validation/creator-identity-v3-real.json",
    "evidence/validation/creator-lexicon-v3-real.json",
    "evidence/validation/creator-visual-model-artifact-audit.json",
    "evidence/validation/creator-visual-real-validation.json",
    "evidence/validation/human-review-v4.json",
    "evidence/validation/trusted-speech-v3-real.json",
    "evidence/validation/visual-dataset-audit.json",
    "evidence/validation/visual-dataset-manifest.json",
    "evidence/validation/visual-holdout-results.json",
    "evidence/validation/visual-identity-spans-real.json",
    "evidence/validation/visual-model-benchmark.json",
    "evidence/validation/visual-model-selection.json",
    "evidence/validation/voice-profile-v3-real.json",
    "knowledge/creator-visual-identity.md",
    "resources/creator_visual_identity_v1/identity-model.joblib",
    "scripts/benchmark_creator_visual_identity.py",
    "scripts/build_creator_visual_dataset.py",
    "scripts/promote_creator_adaptive_evidence.py",
    "scripts/run_creator_adaptive_v3.py",
    "scripts/validate_creator_visual_identity_real.py",
    "specs/capabilities/avatar_identity_provider.md",
    "specs/capabilities/creator_adaptive_asr.md",
    "specs/capabilities/creator_visual_identity.md",
    "specs/capabilities/index.yaml",
    "specs/capabilities/trusted_speech_memory.md",
    "specs/capabilities/voice_profile.md",
    "specs/contracts/creator-visual-identity-contract.md",
    "src/acfv/cli/__main__.py",
    "src/acfv/cli/creator_profile.py",
    "src/acfv/cli/creator_visual.py",
    "src/acfv/creator_adaptive/bootstrap.py",
    "src/acfv/creator_visual_identity/__init__.py",
    "src/acfv/creator_visual_identity/dataset.py",
    "src/acfv/creator_visual_identity/encoders.py",
    "src/acfv/creator_visual_identity/model.py",
    "src/acfv/creator_visual_identity/provider.py",
    "src/acfv/human_review/dataset.py",
    "src/acfv/human_review/gui.py",
    "src/acfv/product_gui/backend.py",
    "src/acfv/trusted_speech_memory/service.py",
    "src/acfv/voice_profile/service.py",
    "tests/integration/test_cgnk_repository_guards.py",
    "tests/unit/test_creator_adaptive_understanding.py",
    "tests/unit/test_creator_visual_identity.py",
    "tests/unit/test_human_review.py"
  ],
  "behavior_change": true,
  "contract_change": true,
  "migration_required": false,
  "compatibility": "Additive creator_profile_v3; v1/v2 data and generic ASR remain isolated and available.",
  "risks": [
    "Visual precision has recording-prior proxy truth but not completed human frame labels.",
    "Adaptive WER is not evaluated without independent human transcripts.",
    "Creator lexicon remains empty because the strict repeated-trusted-term gate did not pass."
  ]
}
